Timestamp; Azione;Valore; Tempo di esecuzione (ms)
1,69409E+12;Avvio esperimento 4;;0
1,69409E+12;Inserimento del valore mario nel campo nome;mario;3109
1,69409E+12;Inserimento del valore rossi nel campo cognome;rossi;3121
1,69409E+12;Inserimento del valore uomo uomo nel campo genere;uomo;2367
1,69409E+12;Inserimento del valore sono un ragazzo molto solare che ama gli animali stare all'aperto mi piace molto il calcio nel campo descrizione;sono un ragazzo molto solare che ama gli animali stare all'aperto mi piace molto il calcio;9420
1,69409E+12;Fine esperimento 4 ;;52895
