Timestamp; Azione;Valore; Tempo di esecuzione (ms)
1,69E+12;Avvio esperimento 1 ;;0
1,69E+12;Inserimento del valore mario nel campo nome;mario;5357
1,69E+12;Inserimento del valore russi nel campo cognome;russi;3982
1,69E+12;Errore comando input non capito;;1982
1,69E+12;Errore comando genera valore uomo non capito;genera valore uomo;2693
1,69E+12;Selezione del valore uomo nella select genere;uomo;8034
1,69E+12;Inserimento del valore sono un ragazzo molto solare che ama gli animali e stare all'aperto mi piace molto il calcio nel campo descrizione;sono un ragazzo molto solare che ama gli animali e stare all'aperto mi piace molto il calcio;12310
1,69E+12;Fine esperimento 1 ;;36806
