Timestamp; Azione; Valore; Tempo di esecuzione (ms)
1695026406594;Avvio esperimento 4;;0
1695026410154;Inserimento del valore antonio nel campo nome;antonio;3560
1695026413271;Inserimento del valore esposito nel campo cognome;esposito;2539
1695026416977;Selezione del valore uomo nella select genere;uomo;2283
1695026423991;Inserimento del valore sono un appassionato di musica e amo suonare la mia chitarra elettrica nel campo descrizione;sono un appassionato di musica e amo suonare la mia chitarra elettrica;5722
1695026426854;Fine esperimento 4 ;;20260
